{
  "$schema": "https://json-schema.org/draft/2020-12/schema",
  "$id": "https://aeren.local/artifact.schema.json",
  "title": "Complete Stack Artifact",
  "type": "object",
  "additionalProperties": false,
  "required": [
    "id",
    "referent",
    "category_path",
    "representation_type",
    "boundary",
    "canonical_source",
    "generated_outputs",
    "checks",
    "inputs",
    "interfaces",
    "outputs",
    "witness_depth",
    "provenance"
  ],
  "properties": {
    "id": {
      "type": "string",
      "minLength": 1
    },
    "referent": {
      "type": "string",
      "minLength": 1
    },
    "representation_type": {
      "enum": [
        "program",
        "cad_like",
        "geospatial",
        "system_landscape",
        "math_model",
        "schematic",
        "bom",
        "test_measurement"
      ]
    },
    "boundary": {
      "type": "object",
      "required": [
        "inside",
        "outside"
      ],
      "properties": {
        "inside": {
          "type": "array",
          "items": {
            "type": "string"
          }
        },
        "outside": {
          "type": "array",
          "items": {
            "type": "string"
          }
        }
      },
      "additionalProperties": false
    },
    "inputs": {
      "type": "array",
      "items": {
        "type": "object",
        "required": [
          "name",
          "status"
        ],
        "properties": {
          "name": {
            "type": "string"
          },
          "status": {
            "enum": [
              "witnessed",
              "derived",
              "assumed",
              "placeholder",
              "unknown"
            ]
          },
          "value": {},
          "units": {
            "type": [
              "string",
              "null"
            ]
          },
          "source": {
            "type": [
              "string",
              "null"
            ]
          }
        },
        "additionalProperties": true
      }
    },
    "parameters": {
      "type": "object",
      "default": {}
    },
    "interfaces": {
      "type": "array",
      "items": {
        "type": "string"
      }
    },
    "outputs": {
      "type": "object"
    },
    "assumptions_placeholders": {
      "type": "array",
      "items": {
        "type": "string"
      },
      "default": []
    },
    "witness_depth": {
      "enum": [
        "unknown",
        "researched",
        "represented",
        "modeled",
        "simulated",
        "designed",
        "implemented",
        "tested",
        "built",
        "measured",
        "inspected",
        "validated",
        "deployed_operating"
      ]
    },
    "provenance": {
      "type": "array",
      "items": {
        "type": "string"
      }
    },
    "invalidators": {
      "type": "array",
      "items": {
        "type": "string"
      },
      "default": []
    },
    "downstream": {
      "type": "array",
      "items": {
        "type": "string"
      },
      "default": []
    },
    "category_path": {
      "type": "array",
      "minItems": 1,
      "items": {
        "type": "object",
        "additionalProperties": false,
        "required": [
          "axis",
          "value",
          "relation"
        ],
        "properties": {
          "axis": {
            "type": "string",
            "minLength": 1
          },
          "value": {
            "type": "string",
            "minLength": 1
          },
          "relation": {
            "type": "string",
            "minLength": 1
          }
        }
      }
    },
    "canonical_source": {
      "type": "object",
      "additionalProperties": false,
      "required": [
        "path",
        "format"
      ],
      "properties": {
        "path": {
          "type": "string",
          "minLength": 1
        },
        "format": {
          "type": "string",
          "minLength": 1
        },
        "tool": {
          "type": [
            "string",
            "null"
          ]
        },
        "role": {
          "type": "string",
          "default": "canonical editable/machine-readable representation"
        }
      }
    },
    "generated_outputs": {
      "type": "array",
      "items": {
        "type": "object",
        "additionalProperties": false,
        "required": [
          "path",
          "format"
        ],
        "properties": {
          "path": {
            "type": "string",
            "minLength": 1
          },
          "format": {
            "type": "string",
            "minLength": 1
          },
          "purpose": {
            "type": [
              "string",
              "null"
            ]
          }
        }
      }
    },
    "checks": {
      "type": "array",
      "items": {
        "type": "object",
        "additionalProperties": false,
        "required": [
          "name",
          "status"
        ],
        "properties": {
          "name": {
            "type": "string",
            "minLength": 1
          },
          "status": {
            "enum": [
              "pass",
              "fail",
              "unknown",
              "not_run"
            ]
          },
          "evidence": {
            "type": [
              "string",
              "number",
              "boolean",
              "null"
            ]
          },
          "source": {
            "type": [
              "string",
              "null"
            ]
          }
        }
      }
    }
  }
}
